title,abstract
M-BEV: Masked BEV Perception for Robust Autonomous Driving,"It mimics various missing cases by randomly masking features of different camera views, then leverages the original features of these views as self-supervision, and reconstructs the masked ones with the distinct spatio-temporal context across views."
The Convex Landscape of Neural Networks: Characterizing Global Optima and Stationary Points via Lasso Models,We also show that all the stationary of the nonconvex training objective can be characterized as the global optimum of a subsampled convex program.
Avoiding Data Contamination in Language Model Evaluation: Dynamic Test Construction with Latest Materials,"Data contamination in evaluation is getting increasingly prevalent with the emerge of language models pre-trained on super large, automatically-crawled corpora."
Regulating Intermediate 3D Features for Vision-Centric Autonomous Driving,"To resolve this problem, we propose to regulate intermediate dense 3D features with the help of volume rendering."
IS-DARTS: Stabilizing DARTS through Precise Measurement on Candidate Importance,"Among existing Neural Architecture Search methods, DARTS is known for its efficiency and simplicity."
Decoupled Textual Embeddings for Customized Image Generation,"To decouple irrelevant attributes (i. e., background and pose) from the subject embedding, we further present several attribute mappers that encode each image as several image-specific subject-unrelated embeddings."
Relation-Aware Question Answering for Heterogeneous Knowledge Graphs,"To address this issue, we construct a \textbf{dual relation graph} where each node denotes a relation in the original KG (\textbf{primal entity graph}) and edges are constructed between relations sharing same head or tail entities."
Large Language Models Play StarCraft II: Benchmarks and A Chain of Summarization Approach,StarCraft II is a challenging benchmark for AI agents due to the necessity of both precise micro level operations and strategic macro awareness.
Chasing Fairness in Graphs: A GNN Architecture Perspective,"To this end, we aim to achieve fairness via a new GNN architecture."
DSAF: A Dual-Stage Adaptive Framework for Numerical Weather Prediction Downscaling,"While widely recognized as one of the most substantial weather forecasting methodologies, Numerical Weather Prediction (NWP) usually suffers from relatively coarse resolution and inevitable bias due to tempo-spatial discretization, physical parametrization process, and computation limitation."
"Point Cloud Part Editing: Segmentation, Generation, Assembly, and Selection","Based on this process, we introduce SGAS, a model for part editing that employs two strategies: feature disentanglement and constraint."
XLand-MiniGrid: Scalable Meta-Reinforcement Learning Environments in JAX,"We present XLand-MiniGrid, a suite of tools and grid-world environments for meta-reinforcement learning research inspired by the diversity and depth of XLand and the simplicity and minimalism of MiniGrid."
CLIP-DINOiser: Teaching CLIP a few DINO tricks,"We propose to locally improve dense MaskCLIP features, computed with a simple modification of CLIP's last pooling layer, by integrating localization priors extracted from self-supervised features."
Rectangle Search: An Anytime Beam Search (Extended Version),"In this paper, we propose a new algorithm, rectangle search, that is instead based on beam search, a variant of breadth-first search."
"Celestial Machine Learning: Discovering the Planarity, Heliocentricity, and Orbital Equation of Mars with AI Feynman",Can a machine or algorithm discover or learn the elliptical orbit of Mars from astronomical sightings alone?
SoftCTM: Cell detection by soft instance segmentation and consideration of cell-tissue interaction,"We find that a ""soft"", probability-map instance segmentation ground truth leads to best model performance."
COOPER: Coordinating Specialized Agents towards a Complex Dialogue Goal,"In recent years, there has been a growing interest in exploring dialogues with more complex goals, such as negotiation, persuasion, and emotional support, which go beyond traditional service-focused dialogue systems."
StreamDiffusion: A Pipeline-level Solution for Real-time Interactive Generation,"We introduce StreamDiffusion, a real-time diffusion pipeline designed for interactive image generation."
